Course Code,Course Name,Description,Category,Link
DANCE 453,DANCE REPERTORY THEATRE,"Study of choreography created by member of the faculty and guest artists, leading to public performance. Must be cast in the Faculty Concert or Guest Artist work, and concurrently enrolled in one of the following: DANCE  111, 112, 115, 118, 125, 126, 211, 212, 213, 218 225, 226, 231, 311, 312, 325, or 326. Open to first-year students.",Dance,https://guide.wisc.edu/courses/dance/
DANCE 455,DANCE COMPOSITION III,"Principles of organization in group composition. Planning, composing and presenting of group dances.",Dance,https://guide.wisc.edu/courses/dance/
DANCE 462,SENIOR SEMINAR,"Reflect on the entirety of dance coursework, develop current work in performance and dance scholarship, and prepare for future engagement with the discipline outside the university.",Dance,https://guide.wisc.edu/courses/dance/
DANCE 463,SENIOR PROJECT,"Focuses on artistic and scholarly senior dance projects such as choreography, performance, pedagogy, research studies, papers, and articles.",Dance,https://guide.wisc.edu/courses/dance/
DANCE 466,CURATING THE PRACTICE,"Explores the evolving practice of performance curation in the 21st century, emphasizing the  role of curators and artists in shaping contemporary performance art. Critical engagement with diverse curatorial  practices, considering both historical and emerging models influenced by the 2020 global lockdown, digital  platforms, and virtual spaces. Exploration of how performance reception, access, and curation have been reshaped since 2020, and investigation of new paradigms such as digital and technologically mediated sites for  performance through interdisciplinary discussions, presentations, and guest speakers.",Dance,https://guide.wisc.edu/courses/dance/
DANCE 469,INTERDISCIPLINARY STUDIES IN THE ARTS,Guest artists present topics appropriate to their specializations.,Dance,https://guide.wisc.edu/courses/dance/
DANCE 476,PILATES TEACHING II,Complete a minimum of 3 hours of teaching per week (or equivalent) working with individuals one on one or with group classes. Teach Pilates coursework Level I-V. Attend weekly seminars and mentor meetings.,Dance,https://guide.wisc.edu/courses/dance/
DANCE 552,ADVANCED DANCE REPERTORY AND PERFORMANCE II,"Focuses on the creation and performance of dance repertory, whether through the development of new choreographic works or the re-staging of existing pieces. Emphasizes live performance as a process to contribute to both the creative and performance aspects of the work. Collaboratively engage in critical discussions and provide expert feedback, reinforcing arguments around artistry, excellence, and the role of live performance in contemporary dance. Hands-on experience in contemporary performance skills and techniques related to dance repertory, emphasizing collaboration in the creation and practice of live dance. Requires concurrent enrollment in DANCE 311, 312, 325, or 326 and audition at first class meeting.",Dance,https://guide.wisc.edu/courses/dance/
DANCE 560,CURRENT TOPICS IN DANCE: WORKSHOP,,Dance,https://guide.wisc.edu/courses/dance/
DANCE 567,HISTORY OF SCREENDANCE,"Focus on the history and practice of screendance in its myriad forms including, but not limited to, performance made for the camera, first person narrative, spoken word, fictional cinema, experimental documentary and other forms of mediated performance practice within the broadly defined context of dance. Interdisciplinary approach to making performative work for the screen.",Dance,https://guide.wisc.edu/courses/dance/
DANCE 665,DANCE HISTORY AND THEORY,"Examines dance historical work in the changing field of Dance Studies since the mid-1980s. Introduces significant perspectives on dance history and dance theory, and considers how these impact and relate to dance creation and pedagogy. Engage with new research in dance history, practice archival research methods, and form a teaching approach to dance history that is responsive to the current direction and needs of the field.",Dance,https://guide.wisc.edu/courses/dance/
DANCE 675,DANCE AND COMMUNITY,"Engages with dance arts for and in communities. Working in relation to core ideas about the value of dance/movement in community, covers interdisciplinary research, scholarship, and praxis within this diverse area of work. Investigates how dance and interrelated arts serve as vehicles for social and environmental change in diverse communities. Specific themes might include racial justice, environmental justice, indigenous survival struggles, and how these themes impact or galvanize communities. Theory and practice reaches beyond campus and connects to the H'Doubler legacy as well as the Wisconsin idea.",Dance,https://guide.wisc.edu/courses/dance/
DANCE 679,DANCE FIELD WORK,"Off-campus, in-the-field experience pursuing an intensive, self-directed study or project under faculty guidance and mentorship. Research directly leads to the development of a creative performance project. May be conducted in a local, national, or international community or professional settings as related to student's practice-as-research work. One-on-one high-value creative research activity, individual-level feedback, and model the behavior and norms of academia and professional life. Devise a research project while guided through the research and creative process.",Dance,https://guide.wisc.edu/courses/dance/
DANCE 699,INDEPENDENT PROJECT,,Dance,https://guide.wisc.edu/courses/dance/
DANCE 762,RESEARCH METHODS,"Examines different research methodologies and approaches to researching dance. Topics range  from studio-based research to theoretical research and include: Practice as Research, Embodied Approaches to Research, Ethnographic Methodologies, Dramaturgy, Critical Theory, and Issues in Dance Studies.",Dance,https://guide.wisc.edu/courses/dance/
DANCE 776,DANCE CURRICULUM AND TEACHING PRACTICES,"Foundational structure engaging in various dance teaching experiences. Cultivate self-reflective, student-centered teaching skills through discussions, integrating an awareness of current issues and developments impacting the field with personal artistry. Investigage the expansion and evolution of dance pedagogy to explore and address the evolution of the field at local, regional, national, and global levels.",Dance,https://guide.wisc.edu/courses/dance/
DANCE 990,CREATIVE PROJECT FOR RESEARCH,"Individual research projects following the approval stage of thesis proposal. Create research plans and schedules determined by the particulars of creative research, whether methodologies and approaches are studio-based or theory-based. Early through final stages of thesis projects are guided with faculty mentorship.",Dance,https://guide.wisc.edu/courses/dance/
DANCE 999,INDEPENDENT PROJECT,,Dance,https://guide.wisc.edu/courses/dance/
FOOD SCI 120,SCIENCE OF FOOD,"Relationship between food, additives, processing and health. How foods are processed. Current food controversies.",Food Science,https://guide.wisc.edu/courses/food_sci/
FOOD SCI 140,"THE CHOCOLATE EXPERIENCE: SCIENCE, SOCIETY, AND SUSTAINABILITY","Learn about the history of cocoa and chocolate production, the cultivation of cocoa and processing of cocoa beans to the production of chocolate from cocoa beans. Other topics covered include nutrition and health aspects of cocoa and chocolate consumption and socioeconomic and sustainability issues in cocoa production.",Food Science,https://guide.wisc.edu/courses/food_sci/
FOOD SCI 150,"FERMENTED FOOD AND BEVERAGES: SCIENCE, ART AND HEALTH","Explores the science behind fermented food and beverages, popularized by brewing, winemaking and breadmaking at home and in retail. Introduces the scientific principles that underlie food and beverage processing through fermentation. Covers how basic sciences such as chemistry, biochemistry and microbiology influence the process and desired outcomes when fermenting vegetables, milk, fruit, and grains.",Food Science,https://guide.wisc.edu/courses/food_sci/
FOOD SCI 201,DISCOVERING FOOD SCIENCE,Provides a brief introduction to the different areas of study and career opportunities within the food industry.,Food Science,https://guide.wisc.edu/courses/food_sci/
FOOD SCI 289,HONORS INDEPENDENT STUDY,Research work for honors students under direct guidance of a faculty member in an area encompassing Food Science.  Students are responsible for arranging the work and credits with the supervising instructor.,Food Science,https://guide.wisc.edu/courses/food_sci/
FOOD SCI 299,INDEPENDENT STUDY,Research work for students under direct guidance of a faculty member in an area encompassing Food Science.  Students are responsible for arranging the work and credits with the supervising instructor.,Food Science,https://guide.wisc.edu/courses/food_sci/
FOOD SCI 301,INTRODUCTION TO THE SCIENCE AND TECHNOLOGY OF FOOD,"Introduction to the science and the technology of food manufacture. Covers the basic chemical, physical and microbiological properties of food and manipulation of these properties in the manufacture of food products.",Food Science,https://guide.wisc.edu/courses/food_sci/
FOOD SCI/​AN SCI  305,INTRODUCTION TO MEAT SCIENCE AND TECHNOLOGY,"Application of biological, technological, and economical principles to muscle and related tissue utilized for food.",Food Science,https://guide.wisc.edu/courses/food_sci/
FOOD SCI/​AN SCI  321,FOOD LAWS AND REGULATIONS,"Food laws and regulations, regulatory and commerical grading standards used in the food industry.",Food Science,https://guide.wisc.edu/courses/food_sci/
FOOD SCI/​MICROBIO  324,FOOD MICROBIOLOGY LABORATORY,"Lab exercises dealing with food preservation, spoilage, and food poisoning. Isolation, identification and quantification of specific microbes occurring in foods, and food fermentations by bacteria and yeast.",Food Science,https://guide.wisc.edu/courses/food_sci/
FOOD SCI/​MICROBIO  325,FOOD MICROBIOLOGY,"Principles of food preservation, epidemiology of foodborne illness, agents of foodborne illness, food fermentations and biotechnology.",Food Science,https://guide.wisc.edu/courses/food_sci/
FOOD SCI 330,DAIRY PRODUCTS EVALUATION,"Introduction to sensory analysis of dairy and dairy-alternative products. Individual skill building to evaluate products such as vanilla ice cream, cheddar cheese, cottage cheese, yogurt, milk, and butter by providing mentored sensory training.",Food Science,https://guide.wisc.edu/courses/food_sci/
FOOD SCI 375,SPECIAL TOPICS,Subjects of current interest to undergraduates.,Food Science,https://guide.wisc.edu/courses/food_sci/
FOOD SCI 378,PRECISION FERMENTATION FOR SUSTAINABLE FOODS AND PRODUCTS,"Introduction to principles of precision fermentation, genetic tools used to manipulate the organisms involved in precision fermentation, food and non-food applications of precision fermentation. Topics such as: sustainable manufacturing of alternative proteins, food colorants, artificial sweeteners, amino acids, vitamins, flavoring and blending agents in alternative protein formulations, fatty acids, non-food chemicals of industrial importance, and sustainable feedstocks. Comparison of precision fermentation to traditional fermentations including whiskey, rum and bourbon.",Food Science,https://guide.wisc.edu/courses/food_sci/
FOOD SCI 399,COORDINATIVE INTERNSHIP/COOPERATIVE EDUCATION,An internship under guidance of a faculty or instructional academic staff member in the Food Science department and a internship site supervisor. Students are responsible for arranging the work and credits with the faculty or instructional academic staff member and the internship site supervisor.,Food Science,https://guide.wisc.edu/courses/food_sci/
FOOD SCI 400,STUDY ABROAD IN FOOD SCIENCE,Provides an area equivalency for courses taken on Madison Study Abroad Programs that do not equate to existing UW courses.,Food Science,https://guide.wisc.edu/courses/food_sci/
FOOD SCI 410,FOOD CHEMISTRY,"Nature and chemical behavior of food constituents including proteins, lipids, carbohydrates, water, and enzymes.",Food Science,https://guide.wisc.edu/courses/food_sci/
FOOD SCI 412,FOOD ANALYSIS,Application of quantitative techniques to the determination of composition and quality of food products.,Food Science,https://guide.wisc.edu/courses/food_sci/
FOOD SCI 432,PRINCIPLES OF FOOD PRESERVATION,"Fundamentals of food preservation methods: post-harvest, thermal processing, refrigeration and freezing, control of water activity, chemical preservation, nonthermal methods and control of food packaging.",Food Science,https://guide.wisc.edu/courses/food_sci/
FOOD SCI 437,FOOD SERVICE OPERATIONS,"Fundamentals, principles, and practices of the United States Food Systems, Food Service, and Food Service Management. Introduction to the food service industry as applied in diverse settings, including but not limited to schools, hospitals and restaurants.",Food Science,https://guide.wisc.edu/courses/food_sci/
FOOD SCI 440,PRINCIPLES OF FOOD ENGINEERING,"Application of engineering principles in the analysis of food process operations: properties of gases and vapors, psychrometrics, material and energy balances, fluid flow, heat transfer, microwave heating, mass transfer, packaging film permeability, dehydration.",Food Science,https://guide.wisc.edu/courses/food_sci/
FOOD SCI/​AN SCI/​DY SCI/​SOIL SCI  472,ANIMAL AGRICULTURE AND GLOBAL SUSTAINABLE DEVELOPMENT,"Examines issues related to global agriculture and healthy sustainable development. Using a regional approach and focusing on crops and livestock case studies, students will learn the interdependence between US agriculture and agriculture in emerging economies. Some topics covered include population and food, immigration, the environment; crop and livestock agriculture; global trade; sustainability; food security, the role of women in agriculture, and the role of dairy products in a healthy diet.",Food Science,https://guide.wisc.edu/courses/food_sci/
FOOD SCI/​AN SCI/​DY SCI/​SOIL SCI  473,INTERNATIONAL FIELD STUDY IN ANIMAL AGRICULTURE AND SUSTAINABLE DEVELOPMENT,"Examines issues related to global agriculture and healthy sustainable development. Using a regional approach and focusing on crops and livestock case studies, students will learn the interdependence between US agriculture and agriculture in emerging economies. Some topics covered include population and food, immigration, the environment; crop and livestock agriculture; global trade; sustainability; and the role of women in agriculture and the role of dairy products in a healthy diet.",Food Science,https://guide.wisc.edu/courses/food_sci/
FOOD SCI 511,CHEMISTRY AND TECHNOLOGY OF DAIRY PRODUCTS,"Chemistry of milk components (i.e. protein, lipids, carbohydrate, salts, enzymes) with an emphasis on chemical and physical changes that occur during the manufacture of a range of milk products (i.e. ice cream, butter, cheese). Dairy technology and microbiological quality.",Food Science,https://guide.wisc.edu/courses/food_sci/
FOOD SCI 514,INTEGRATED FOOD FUNCTIONALITY,"Molecular basis of food functional properties; impact of ingredients and processing on functional properties (texture, flavor, nutrition and structure); design of new or reformulating foods to meet specific quality expectations.",Food Science,https://guide.wisc.edu/courses/food_sci/
FOOD SCI/​AN SCI  515,COMMERCIAL MEAT PROCESSING,"Principles and procedures in the commercial manufacture of processed meat products; sausage manufacturing, curing, smoking, freezing and packaging.",Food Science,https://guide.wisc.edu/courses/food_sci/
FOOD SCI 532,INTEGRATED FOOD MANUFACTURING,"Procedures used to process and preserve foods on a commercial basis, with emphasis on concentration, dehydration and fractionation process, plant sanitation/GMP, statistical process control, and environmental impacts..",Food Science,https://guide.wisc.edu/courses/food_sci/
FOOD SCI 535,CONFECTIONERY SCIENCE AND TECHNOLOGY,"Through a combination of on-line lectures, classroom activities, evaluation of commercial samples and discovery-based labs, the science and technology of confections from hard candy to chocolate will be covered.",Food Science,https://guide.wisc.edu/courses/food_sci/
FOOD SCI 550,FERMENTED FOODS AND BEVERAGES,"Chemistry, microbiology, and technology of foods and beverages in which fermentations are important (e.g. cheese, bread, pickles, beer). Fermentation techniques in developing new foods and food additives. Instrumentation and mechanization of food fermentations.",Food Science,https://guide.wisc.edu/courses/food_sci/
FOOD SCI 551,FOOD FERMENTATION LABORATORY,Offers the opportunity to learn to produce fermented beverages and dairy products in laboratory and scalable production facilities. Designed to introduce the chemical and physical basis for development of specific characteristics associated with individual styles of products as well as analytical methods to qualify those characteristics. Enrollment limited to students 21 years of age or older,Food Science,https://guide.wisc.edu/courses/food_sci/
FOOD SCI 602,SENIOR PROJECT,"Part one of senior capstone requirement. Working as teams, students conduct research around a problem pertinent to the food industry. Weekly discussions plus laboratory. Data collection and analysis and report writing are critical components of this course.",Food Science,https://guide.wisc.edu/courses/food_sci/
FOOD SCI 603,SENIOR SEMINAR,Part two of senior capstone requirement. Students will present data gathered and analyzed as part of the senior project.,Food Science,https://guide.wisc.edu/courses/food_sci/
FOOD SCI 611,CHEMISTRY AND TECHNOLOGY OF DAIRY PRODUCTS,"Chemistry of milk components (i.e. protein, lipids, carbohydrate, salts, enzymes) with an emhasis on chemical and physical changes that occur during the manufacture of a range of milk products (i.e. ice cream, butter, cheese). Dairy technology and microbiological quality.",Food Science,https://guide.wisc.edu/courses/food_sci/
FOOD SCI 681,SENIOR HONORS THESIS,Individual study for majors completing theses for Honors degrees as arranged with a faculty member.,Food Science,https://guide.wisc.edu/courses/food_sci/
FOOD SCI 682,SENIOR HONORS THESIS,Second semester of individual study for majors completing theses for Honors degrees as arranged with a faculty member.,Food Science,https://guide.wisc.edu/courses/food_sci/
FOOD SCI 699,SPECIAL PROBLEMS,Individual advanced work in an area of Food Science under the direct guidance of a faculty member.,Food Science,https://guide.wisc.edu/courses/food_sci/
FOOD SCI/​AN SCI  710,CHEMISTRY OF THE FOOD LIPIDS,"Chemical constitution, structures, reactions, stereochemistry of fats, phospholipids, related compounds; methods of isolation, characterization; synthesis; relation of structure to physical properties.",Food Science,https://guide.wisc.edu/courses/food_sci/
FOOD SCI/​AN SCI  711,FOOD BIOCHEMISTRY,"Explores methods for interrogating structure-function relationships, molecular profiles, and microstructure of foods. Provides hands-on experience using computational approaches to model protein-small molecule interactions, analysis of small molecules using high-resolution MS, and protein composition and morphology with fluorescence spectroscopy and microscopy. Knowledge of food chemistry or organic chemistry (such as FOOD SCI 410, CHEM 341, 343, or 345) required.",Food Science,https://guide.wisc.edu/courses/food_sci/
FOOD SCI 725,ADVANCED FOOD MICROBIOLOGY,"Principles and problems covering fundamental concepts in Food Microbiology; application of concepts in fermentation, pathogenesis, and gut health; development and control of a sustainable and safe food and fiber system.",Food Science,https://guide.wisc.edu/courses/food_sci/
FOOD SCI 799,PRACTICUM IN FOOD SCIENCE TEACHING,Teaching experience for PhD candidates.,Food Science,https://guide.wisc.edu/courses/food_sci/
FOOD SCI 875,SPECIAL TOPICS,New graduate and courses of current interest.,Food Science,https://guide.wisc.edu/courses/food_sci/
FOOD SCI 900,SEMINAR ADVANCED,Research literature and current departmental research.,Food Science,https://guide.wisc.edu/courses/food_sci/
FOOD SCI 990,RESEARCH,Full lab and literature review of a problem in food science. Leads to preparation of thesis and publication.,Food Science,https://guide.wisc.edu/courses/food_sci/
KINES 100,"EXERCISE, NUTRITION, AND HEALTH","Guidelines and assessment methods for fitness and nutrition. Motivation, adherence and stress-reduction techniques discussed. Lecture-demonstration concerning effects of exercise and nutrition on health and well-being.",Kinesiology,https://guide.wisc.edu/courses/kines/
KINES 104,AQUATICS,"Attainment and maintenance of a high degree of personal efficiency in swimming strokes and proficiency in fundamental aquatic skills, and an understanding of the fundamental physiological, mechanical and kinesiological principles as they relate to aquatic performance.",Kinesiology,https://guide.wisc.edu/courses/kines/
KINES 112,MAKE IT COUNT: MEASURING PHYSICAL ACTIVITY BEHAVIOR,Define exercise and physical activity behaviors and how to systematically measure them. Content will encompass the American College of Sports Medicine definition of physical activity and recommendations for exercise across different populations. Students will engage in a service learning opportunity with our adapted fitness program where they will practice measuring and addressing the difficulties in broadly defining physical activity.,Kinesiology,https://guide.wisc.edu/courses/kines/
KINES 115,PHYSIOLOGY OF HUMAN PERFORMANCE,"Humans are capable of achieving astonishing performances in athletics, in work and in other extraordinary situations. These extraordinary performances often provide important insights into physiological processes and their limits. This course integrates information from biology, chemistry, psychology, mechanics, etc., to understand the factors that determine and limit human performance from the molecular level all the way up to whole body movement. The emphasis in the class is on using case studies to investigate physiological processes underlying movement, exercise, and performance.",Kinesiology,https://guide.wisc.edu/courses/kines/
KINES 116,FIRST AID AND BASIC LIFE SUPPORT,"Techniques and procedures to deal effectively with common emergencies. Includes training in airway obstruction, cardiopulmonary resuscitation, automated external defibrillation, injuries, and medical emergencies.",Kinesiology,https://guide.wisc.edu/courses/kines/
KINES 119,INTRODUCTION TO KINESIOLOGY,"Introduces students to the field of kinesiology and the Department of Kinesiology at the University of Wisconsin-Madison. Introductory material about physical activity and health will be provided, and career opportunities in kinesiology will be discussed.",Kinesiology,https://guide.wisc.edu/courses/kines/
KINES 121,FOUNDATIONS OF PHYSICAL EDUCATION,"Introduction to physical education teaching, movement education, and an operational understanding of the scientific study of human movement. Lecture and lab.",Kinesiology,https://guide.wisc.edu/courses/kines/
KINES 123,LIVING WELL: LIFESTYLE REDESIGN AND HEALTH PROMOTION FOR COLLEGE STUDENTS,"Focuses on the application of biological, cultural and social theory and research to lifestyle change. There will be lectures by experts, experiential learning, and the application of course knowledge to student's lives through class assignments and activities. The transition to college requires students to construct a new lifestyle, take on new and greater personal responsibilities while at the same time meet rigorous academic challenges. This transition includes a loss of structured daily schedules, decreased family support for the day to day living, and greater responsibility for their finances and life choices. Students may have difficulty managing their time, exercise less, eat less healthy foods, engage in increased drinking of alcohol, and experience greater stress and depression when adjusting to college life. This life transition provides an opportunity for reexamination and an opportunity to make thoughtful choices about lifestyle.",Kinesiology,https://guide.wisc.edu/courses/kines/
KINES 125,ADAPTED FITNESS AND PERSONAL TRAINING,Fitness class for developing individualized personal goals. Accommodates persons having temporary or permanent disability. Alternative to dropping from other program classes due to injury or other medical reason.,Kinesiology,https://guide.wisc.edu/courses/kines/
KINES 127,INTRODUCTION TO ATHLETIC HEALTHCARE,"Issues and basic concepts of athletic healthcare including health care systems, interprofessonal teams, and injuries and conditions common to active populations. Emphasis on the team approach to patient care with exposure to a variety of health science professions.",Kinesiology,https://guide.wisc.edu/courses/kines/
KINES 140,SCIENCE AND PRACTICE OF RESISTANCE TRAINING,Lectures and demonstrations on the principles of resistance training and associated physiological effects designed for practitioners who wish to gain a detailed understanding of the science of resistance training.,Kinesiology,https://guide.wisc.edu/courses/kines/
